[
  {
    "v": 1,
    "kind": "hello",
    "deviceId": "00000000-0000-4000-8000-000000000001",
    "name": "测试手机"
  },
  {
    "v": 1,
    "kind": "start",
    "session": "00000000-0000-4000-8000-000000000002",
    "seq": 1
  },
  {
    "v": 1,
    "kind": "intent",
    "session": "00000000-0000-4000-8000-000000000002",
    "seq": 2,
    "intent": "AWAY"
  },
  {
    "v": 1,
    "kind": "stop",
    "session": "00000000-0000-4000-8000-000000000002",
    "seq": 3
  }
]
